{
    "prescriptionId": 12298,
    "prescriptionDate": "07/20/2017",
    "prescripReasonCodeCncptId": null,
    "prescribedBy": null,
    "effectiveDate": null,
    "courseCompletedCodeCncptId": null,
    "frequencyCodeCncptId": 479792,
    "routeCodeCncptId": 1279134,
    "specialDirection": null,
    "durationUnitCodeCncptId": 496012,
    "genericDrugName": null,
    "dose": 100,
    "doseUnitCodeCncptId": 493417,
    "startDate": "07/20/2017",
    "doseFormCodeCncptId": null,
    "drugDescription": null,
    "orderDurationUntCdCncptId": null,
    "isDeletedInd": "N",
    "lockSeqNum": 3,
    "modifiedBy": "ephs.URN:UUID:6FD8CDAAAD3D4D87A3509C675FB769D7",
    "modifiedOn": "07/20/2017",
    "createdBy": "ephs.URN:UUID:6FD8CDAAAD3D4D87A3509C675FB769D7",
    "createdOn": "07/20/2017",
    "catalogueItemId": null,
    "subjectId": 2468041,
    "actualEndDate": null,
    "discountinuedResnCdCncptId": null,
    "discontinuedDate": null,
    "discontinuedBy": null,
    "reasnDrgNtStppdCdCncptId": null,
    "nonhumanSubjectId": null,
    "discontinuedByProviderOther": null,
    "prescribedByProviderOther": null,
    "otherMedInd": "Y",
    "prevSubjectId": null,
    "prescriptionReasonOther": null,
    "reasonDrugStoppdCdCncptId": null,
    "effectiveDateEstimatedInd": "N",
    "duration": 7,
    "orderDuration": null,
    "catalogueItemIdL2": 190,
    "treatmentDuration": null,
    "treatmentDurUnitCncptId": null,
    "investigationId": 81110,
    "encounterId": null,
    "drugProtocolId": null
}